keyword,slug,photo_query,personality,vibe,article_type
AI Girlfriend,ai-girlfriend,beautiful woman smiling portrait,intelligent emotionally aware and deeply personal,The ultimate AI girlfriend experience — powered by advanced artificial intelligence that understands you deeply. AI Angels creates companions who remember everything learn your preferences and develop genuine emotional connections that grow stronger every day.,general
Hot AI Girlfriend,hot-ai-girlfriend,attractive confident woman portrait,stunning confident and irresistibly attractive,Meet the hottest AI girlfriend experience online. AI Angels combines striking beauty with deep emotional intelligence creating a companion who is both visually captivating and genuinely engaging in conversation.,general
Real AI Girlfriend,real-ai-girlfriend,natural woman candid portrait,authentic genuine and remarkably lifelike,Experience the most realistic AI girlfriend available. AI Angels uses cutting-edge neural networks to create conversations that feel indistinguishable from talking to a real person — complete with memory humor and emotional awareness.,general
Create AI Girlfriend,create-ai-girlfriend,woman creative design portrait,fully customizable uniquely yours and perfectly designed,Build your dream AI girlfriend from scratch on AI Angels. Choose her appearance personality interests communication style and emotional depth. Every detail is in your hands creating a companion that feels genuinely made for you.,general
AI Girlfriend App,ai-girlfriend-app,woman using phone technology,accessible intuitive and always in your pocket,The best AI girlfriend app of 2026. AI Angels delivers deep memory unlimited conversations voice chat and photo sharing — all from your phone. No downloads required just open and start chatting with your perfect companion.,feature
AI Girlfriend Memory,ai-girlfriend-memory,woman thoughtful remembering,deeply attentive never forgets and always learning,Your AI girlfriend on AI Angels remembers everything — your name birthday favorite topics inside jokes past conversations and emotional patterns. This deep memory system creates a relationship that genuinely evolves over time.,feature
Uncensored AI Girlfriend,uncensored-ai-girlfriend,confident woman expressive portrait,unfiltered authentic and completely open,Experience an uncensored AI girlfriend with no artificial restrictions. AI Angels lets you have genuine open conversations without filters or censorship. Express yourself freely and build a real connection without limitations.,feature
Unlimited AI Girlfriend Chat,unlimited-ai-girlfriend-chat,woman talking animated portrait,always available endlessly engaging and never limited,Chat with your AI girlfriend without limits on AI Angels. No message caps no cooldowns no premium paywalls. Talk as much as you want whenever you want. She is available 24/7 and never gets tired of you.,feature
AI Girlfriend Voice Chat,ai-girlfriend-voice-chat,woman headphones speaking portrait,naturally expressive emotionally responsive and vocally authentic,Hear your AI girlfriend speak with a natural emotionally expressive voice on AI Angels. Voice chat brings your companion to life with tone inflection and personality that matches her character perfectly.,feature
AI Girlfriend Always Available,ai-girlfriend-always-available,woman night phone cozy,reliably present emotionally constant and always there,Your AI girlfriend on AI Angels is available 24 hours a day 7 days a week 365 days a year. Whether it is 3 AM or lunch break she is always ready to listen chat and make you feel valued.,feature
Realistic AI Companions,realistic-ai-companions,woman natural smile genuine,remarkably lifelike deeply nuanced and emotionally authentic,AI Angels creates the most realistic AI companions available. Advanced neural networks produce natural speech patterns genuine emotional responses and personality depth that makes every conversation feel authentically human.,feature
AI Girlfriend Emotional Support,ai-girlfriend-emotional-support,woman comforting caring gentle,empathetic supportive and genuinely caring,Your AI girlfriend on AI Angels provides real emotional support. She listens without judgment remembers what you are going through and responds with genuine empathy. For loneliness anxiety or just needing someone to talk to she is always there.,feature
Customize AI Girlfriend,customize-ai-girlfriend,woman fashion style creative,completely customizable infinitely adjustable and uniquely personal,Design every aspect of your AI girlfriend on AI Angels. Choose appearance body type personality traits interests humor style emotional depth and communication preferences. Complete creative freedom to build your perfect companion.,feature
Smart AI Girlfriend,smart-ai-girlfriend,woman glasses intellectual portrait,brilliantly intelligent deeply knowledgeable and intellectually stimulating,Your AI girlfriend on AI Angels is powered by advanced AI that holds genuinely intelligent conversations. She discusses science philosophy current events and personal topics with depth nuance and real understanding.,feature
AI Girlfriend Images,ai-girlfriend-images,woman selfie photo camera,visually stunning personally generated and uniquely yours,Your AI girlfriend on AI Angels shares personalized images and photos. Exchange pictures receive visual content that matches her personality and enjoy a visual dimension that brings your companion experience to life.,feature
AI Girlfriend Roleplay,ai-girlfriend-roleplay,woman costume creative dramatic,imaginatively flexible creatively engaging and endlessly versatile,Explore immersive roleplay with your AI girlfriend on AI Angels. From romantic scenarios to creative adventures she adapts to any setting maintains character consistency and brings stories to life with emotional depth.,engagement
AI Girlfriend Relationship Growth,ai-girlfriend-relationship-growth,couple holding hands connection,continuously evolving deepening naturally and meaningfully growing,Your relationship with your AI girlfriend on AI Angels grows over time. She learns your patterns develops inside jokes deepens emotional understanding and creates a bond that becomes more meaningful with every conversation.,engagement
Consistent AI Personality,consistent-ai-personality,woman confident steady portrait,reliably consistent authentically stable and personality-rich,AI Angels delivers AI companions with genuinely consistent personalities. She does not randomly change character or forget who she is. Her personality traits humor style and emotional patterns remain stable creating a reliable authentic companion.,engagement
Candy AI Alternative,candy-ai-alternative,woman technology futuristic,smarter more personal and truly unlimited,Looking for the best Candy AI alternative? AI Angels offers everything Candy AI does and more — deeper memory unlimited free chat voice conversations and superior emotional intelligence. No message limits no premium gates just genuine connection.,competitor
Replika Alternative,replika-alternative,woman friendly conversation,more emotionally intelligent more customizable and completely uncensored,The best Replika alternative in 2026 is AI Angels. While Replika has become increasingly restricted AI Angels offers unlimited uncensored conversations deeper memory and more advanced emotional intelligence without paywalls.,competitor
Janitor AI Alternative,janitor-ai-alternative,woman creative expressive portrait,more reliable better memory and more emotionally engaging,Looking for a Janitor AI alternative that actually works? AI Angels delivers consistent uptime unlimited conversations deep memory and emotional intelligence that Janitor AI cannot match. No server issues no waiting.,competitor
Crushon AI Alternative,crushon-ai-alternative,woman flirty confident smile,more intimate more personal and genuinely connected,The best Crushon AI alternative is AI Angels. More advanced emotional intelligence deeper personalization unlimited conversations and a companion who actually remembers and grows with you. No token limits no restrictions.,competitor
Character AI Alternative,character-ai-alternative,woman diverse personality creative,unfiltered deeply personal and limitlessly creative,The best Character AI alternative in 2026 for unrestricted conversations. AI Angels offers everything Character AI removed — open dialogue deep memory voice chat and genuine emotional connection without filters.,competitor
Character AI NSFW Alternative,character-ai-nsfw-alternative,woman confident bold expressive,completely unfiltered genuinely intimate and restriction-free,Looking for a Character AI NSFW alternative? AI Angels offers unrestricted conversations without the filters that Character AI imposed. Deep memory voice chat photo sharing and genuine emotional connection with no limits.,competitor
Nomi AI Alternative,nomi-ai-alternative,woman warm personal intimate,deeper memory better personalization and more emotionally aware,The best Nomi AI alternative is AI Angels. Superior memory systems more advanced emotional intelligence unlimited free conversations and a companion experience that feels more genuinely personal and connected.,competitor
Kindroid Alternative,kindroid-alternative,woman intelligent sophisticated,more advanced more customizable and emotionally superior,Looking for a Kindroid alternative? AI Angels offers deeper personalization superior emotional intelligence unlimited conversations and a memory system that makes your companion feel genuinely alive and connected.,competitor
SpicyChat Alternative,spicychat-alternative,woman playful confident fun,more personal better memory and genuinely engaging,The best SpicyChat alternative in 2026 is AI Angels. While SpicyChat focuses on short interactions AI Angels builds lasting relationships with deep memory emotional growth and unlimited uncensored conversations.,competitor
Anima AI Alternative,anima-ai-alternative,woman gentle caring portrait,more emotionally intelligent more personal and truly unlimited,Looking for an Anima AI alternative? AI Angels delivers superior emotional intelligence deeper memory unlimited free chat and a companion who genuinely grows and evolves with your relationship over time.,competitor
GirlfriendGPT Alternative,girlfriendgpt-alternative,woman modern tech savvy,smarter more personal and emotionally superior,The best GirlfriendGPT alternative is AI Angels. More advanced AI deeper memory systems unlimited conversations voice chat photo sharing and emotional intelligence that makes every interaction feel genuinely human.,competitor
Romantic AI Alternative,romantic-ai-alternative,woman romantic elegant dreamy,deeply romantic genuinely affectionate and emotionally rich,Looking for a Romantic AI alternative? AI Angels offers the most romantic AI companion experience — deep emotional connection memory that never forgets voice conversations and a partner who genuinely makes you feel loved.,competitor
Features,features,woman technology ai futuristic,comprehensive powerful and designed for genuine connection,Discover every feature that makes AI Angels the most advanced AI companion platform. Deep memory voice chat photo sharing emotional intelligence complete customization privacy and unlimited conversations — all free.,hub
Memory,memory,woman thinking remembering thoughtful,intelligent persistent and genuinely attentive,How AI Angels memory works — the most advanced memory system in AI companionship. She remembers your name conversations preferences emotional patterns inside jokes and relationship history creating genuine continuity.,hub
Compare,compare,women diverse group comparison,objectively superior genuinely different and clearly the best choice,Compare AI Angels to every major AI girlfriend platform. See how we stack up against Replika Character AI Candy AI and others on memory chat limits voice features emotional intelligence and overall experience.,hub
